{
  "profile_metadata": {
    "profile_id": "ASR001-SYN-DIST-001",
    "profile_version": "0.1",
    "status": "draft",
    "created_date": "2026-07-24",
    "revised_date": "2026-07-24",
    "language": "en",
    "asr_working_draft_version": "0.1",
    "subject_id": "SYN-DIST-CONTEST-001",
    "license_notice": "Synthetic fixture for testing; no claim about a real product."
  },
  "subject": {
    "canonical_subject": {
      "subject_id": "SYN-DIST-CONTEST-001",
      "object_type": "contest_configuration",
      "name": "Synthetic Distributed Cycling Contest Configuration",
      "configuration": "remote synchronous cycling contest with smart resistance and shared computational course",
      "version": "synthetic-0.1",
      "temporal_status": "current"
    },
    "related_objects": []
  },
  "operating_context": {
    "deployment_type": "contest_configuration",
    "locations": [
      "synthetic test environment"
    ],
    "participant_setting": "controlled",
    "intended_use": "ASR-001 implementation-model validation",
    "temporal_status": "current"
  },
  "system_roles_and_dependencies": {
    "system_roles": [
      "competition",
      "measurement",
      "officiation",
      "broadcasting"
    ],
    "technical_dependencies": [
      "shared computational state",
      "smart resistance devices",
      "network synchronization"
    ],
    "institutional_dependencies": [],
    "equipment_dependencies": [],
    "organizational_dependencies": []
  },
  "feature_flags": {
    "human_performance_claimed": true,
    "agency_modes_or_handoff_present": true,
    "embodiment_or_biological_control_claimed": true,
    "distributed_operation_claimed": true,
    "rules_or_constraints_present": true,
    "sensing_or_tracking_present": true,
    "measurement_or_comparison_claimed": true,
    "contest_or_outcome_present": true,
    "spatial_function_claimed": true,
    "participatory_actor_present": true,
    "operational_responsibility_material": true,
    "machine_readable_distribution_provided": true
  },
  "performance": {
    "performance_window": {
      "start": "official start signal",
      "end": "official finish state",
      "basis": "rider power and tactical action affect result"
    },
    "agency_segments": [
      {
        "segment": "contest",
        "human_role": "live_performance",
        "automation": "declared resistance control",
        "status": "supported"
      }
    ],
    "interface_channels": [
      "cycle_ergometer",
      "smart_resistance",
      "physiological_sensor"
    ],
    "embodied_demand": {
      "types": [
        "endurance",
        "force",
        "sensorimotor_coordination"
      ],
      "minimum_threshold_claimed": false
    }
  },
  "arena": {
    "configuration": {
      "physical_arena": "separate participant stations",
      "computational_arena": "shared synchronous course",
      "unified_relation": "course state changes mechanical demand and race position"
    },
    "distributed_relation": {
      "topology": "remote_synchronous",
      "shared_state": true,
      "synchronization": "synthetic event protocol",
      "latency_tolerance": "not normatively specified",
      "calibration_relation": "same synthetic device class",
      "safety_responsibility": "each site operator"
    }
  },
  "constraints": {
    "authoritative_sources": [
      "EV-RULE-001"
    ],
    "execution": {
      "modes": [
        "software",
        "equipment",
        "human_official"
      ]
    }
  },
  "sensing": {
    "observation_estimation_boundary": {
      "direct": [
        "power",
        "cadence"
      ],
      "estimated": [
        "virtual speed",
        "position"
      ]
    },
    "failure_and_uncertainty": [
      "packet loss",
      "device drift",
      "sensor dropout"
    ]
  },
  "measurement": {
    "metrics": [
      {
        "name": "power",
        "unit": "watts",
        "calibration_basis": "synthetic device protocol",
        "intended_use": "contest state"
      },
      {
        "name": "finish time",
        "unit": "seconds",
        "calibration_basis": "shared event clock",
        "intended_use": "result"
      }
    ],
    "comparability_conditions": [
      "same device class",
      "same software version",
      "declared calibration check",
      "shared ruleset"
    ]
  },
  "outcome": {
    "officiation_and_authority": {
      "software_authority": "course state and provisional finish",
      "human_authority": "event official",
      "appeal_path": "synthetic review procedure"
    },
    "outcome_and_consequence": {
      "outcome_openness": "supported",
      "result": "ranked finish",
      "consequence_structure": [
        "ranking",
        "qualification"
      ]
    }
  },
  "spatial_integration": {
    "functions": [
      {
        "function": "constrain",
        "mechanism": "course geometry and resistance"
      },
      {
        "function": "measure",
        "mechanism": "power and shared state"
      },
      {
        "function": "compare",
        "mechanism": "common event state"
      },
      {
        "function": "officiate",
        "mechanism": "software event detection with human review"
      }
    ],
    "failure_effects": [
      "loss of shared state invalidates remote comparison",
      "loss of resistance control changes configured task"
    ]
  },
  "actors": {
    "roles": [
      {
        "role": "participant",
        "performance_agent": true
      },
      {
        "role": "official",
        "performance_agent": false
      },
      {
        "role": "site_operator",
        "performance_agent": false
      },
      {
        "role": "coach",
        "performance_agent": false
      }
    ],
    "participatory_relations": [
      {
        "actor": "coach",
        "relation": "information",
        "material_effect": "tactical instruction",
        "performance_agent": false
      }
    ]
  },
  "human_factors": {
    "disclosures": [
      "physiological exertion",
      "equipment setup risk",
      "site-specific emergency responsibility"
    ],
    "operational_responsibility": {
      "central_operator": "contest state and rules",
      "site_operator": "equipment and local safety",
      "participant": "declared readiness"
    }
  },
  "evidence": {
    "claims": [],
    "uncertainty_states": [
      "unknown",
      "not_evidenced",
      "not_applicable"
    ],
    "records": [
      {
        "evidence_id": "EV-DECL-001",
        "claim_class": "C1",
        "source_type": "synthetic_specification",
        "title": "Distributed contest configuration declaration",
        "publisher": "AltisSports Synthetic Test Fixture",
        "canonical_url": null,
        "publication_date": "2026-07-24",
        "access_date": "2026-07-24",
        "temporal_status": "current",
        "supports": [
          "subject",
          "operating_context",
          "actors"
        ],
        "limitations": [
          "Synthetic fixture; not evidence about a real product."
        ],
        "attribution_required": true
      },
      {
        "evidence_id": "EV-TECH-001",
        "claim_class": "C1",
        "source_type": "synthetic_specification",
        "title": "Distributed contest technical architecture",
        "publisher": "AltisSports Synthetic Test Fixture",
        "canonical_url": null,
        "publication_date": "2026-07-24",
        "access_date": "2026-07-24",
        "temporal_status": "current",
        "supports": [
          "performance",
          "arena",
          "sensing",
          "spatial_integration"
        ],
        "limitations": [
          "Synthetic technical description; no independent performance validation."
        ],
        "attribution_required": true
      },
      {
        "evidence_id": "EV-RULE-001",
        "claim_class": "C1",
        "source_type": "synthetic_specification",
        "title": "Distributed contest rule and task specification",
        "publisher": "AltisSports Synthetic Test Fixture",
        "canonical_url": null,
        "publication_date": "2026-07-24",
        "access_date": "2026-07-24",
        "temporal_status": "current",
        "supports": [
          "constraints",
          "outcome"
        ],
        "limitations": [
          "Synthetic rules used only to test profile structure."
        ],
        "attribution_required": true
      },
      {
        "evidence_id": "EV-DATA-001",
        "claim_class": "C1",
        "source_type": "synthetic_specification",
        "title": "Distributed contest measurement and comparability protocol",
        "publisher": "AltisSports Synthetic Test Fixture",
        "canonical_url": null,
        "publication_date": "2026-07-24",
        "access_date": "2026-07-24",
        "temporal_status": "current",
        "supports": [
          "measurement"
        ],
        "limitations": [
          "No claim of real-world validity or clinical efficacy."
        ],
        "attribution_required": true
      },
      {
        "evidence_id": "EV-SAFE-001",
        "claim_class": "C1",
        "source_type": "synthetic_specification",
        "title": "Distributed contest safety and accessibility disclosure",
        "publisher": "AltisSports Synthetic Test Fixture",
        "canonical_url": null,
        "publication_date": "2026-07-24",
        "access_date": "2026-07-24",
        "temporal_status": "current",
        "supports": [
          "human_factors"
        ],
        "limitations": [
          "Disclosure test only; not safety certification."
        ],
        "attribution_required": true
      },
      {
        "evidence_id": "EV-GOV-001",
        "claim_class": "C1",
        "source_type": "synthetic_specification",
        "title": "Distributed contest governance and correction procedure",
        "publisher": "AltisSports Synthetic Test Fixture",
        "canonical_url": null,
        "publication_date": "2026-07-24",
        "access_date": "2026-07-24",